{
  "flightScheduleId": 12345678,
  "flightNumber": "QF425",
  "departureDate": "2019-10-16",
  "scheduledDepartureTime": "2019-10-16T06:10:39+00:00",
  "estimatedDepartureTime": "2019-10-16T06:20:59+00:00",
  "originPort": "Sydney",
  "originCountry": "Australia",
  "destinationPort": "Melbourne",
  "destinationCountry": "Australia",
  "airline": "QF"
}